project_name,debian_source,debian_version,debian_desc,debian_home,CVE_since_2010,CVE_page,openhub_page,openhub_name,openhub_desc,openhub_home,openhub_download,twelve_month_contributor_count,total_contributor_count,total_code_lines,main_language_name,licenses,fact_activity,fact_age,fact_comments,fact_team_size,package_popularity,implemented_in,role,direct_network_exposure,process_network_data,potential_privilege_escalation,risk_index(max = 15),risk_index components,comment_on_priority
wget,,1.15-1ubuntu1.14.04.1,retrieves files from the web,http://www.gnu.org/software/wget/,2,https://security-tracker.debian.org/tracker/source-package/wget,https://www.openhub.net/projects/wget,Wget,"GNU Wget is a free software package for retrieving files using HTTP, HTTPS and FTP, the most widely-used Internet protocols. It is a non-interactive commandline tool, so it may easily be called from scripts, cron jobs, terminals without X-Windows support, etc.",http://www.gnu.org/software/wget/,http://ftp.gnu.org/pub/gnu/wget/,35,120,41675,C,GNU General Public License v2.0 or later,Increasing Y-O-Y development activity,"Mature, well-established codebase",Well-commented source code,"Very large, active development team",175676,,,1,0,0,8,"Website points: 0, CVE: 2, 12-month contributor: 0, Popularity: 2, Language: 2, Exposure: 2 , Data only: 0","Directly processes potentially-malicious data from the Internet, often used in scripts. GNU project. https://www.gnu.org/software/wget/ Actual development on GNU's Savannah using git and its bugtracker, http://savannah.gnu.org/projects/wget/ Actively developed, many patches. wget-1.16.3 released 2015-03-09 on downloads. Note that this is directly exposed to attack.  It has some code documentation (e.g., http://wget.addictivecode.org/NavigatingTheSource), but it warns that it can be fairly hard to follow, contains a fair number of hacks, and functionality that was ""tacked on"" (which is not good for security). ++"
whiptail,newt,0.52.15-2ubuntu5,Displays user-friendly dialog boxes from shell scripts,https://fedorahosted.org/newt/,0,https://security-tracker.debian.org/tracker/source-package/newt,https://www.openhub.net/projects/newt,Ne.W.T.,NEthack With Tiles - A graphical interface for NetHack and Slash'EM,http://www.darkarts.co.za/newt,,1,1,698779,C,Nethack General Public License,Increasing Y-O-Y development activity,,Few source code comments,Only a single active developer,175209,,,0,0,0,8,"Website points: 0, CVE: 0, 12-month contributor: 4, Popularity: 2, Language: 2, Exposure: 0 , Data only: 0",
xml-core,,0.13+nmu2,XML infrastructure and XML catalog file support,,0,https://security-tracker.debian.org/tracker/source-package/xml-core,https://www.openhub.net/projects/perl-xml-simple,XML::Simple,"XML::Simple is a Perl module that makes it really easy to read and write XML files. It was originally developed for the purpose of reading and writing config files in XML format, many people find it useful for other purposes.",http://search.cpan.org/dist/XML-Simple/,,0,1,4350,Perl,Artistic License 2.0 GNU General Public License v2.0 or later,Stable Y-O-Y development activity,"Mature, well-established codebase",Well-commented source code,No recent development activity,162775,,,0,1,0,8,"Website points: 0, CVE: 0, 12-month contributor: 5, Popularity: 2, Language: 0, Exposure: 1 , Data only: 0",
xserver-common,xorg-server,2:1.15.1-0ubuntu2.7,common files used by various X servers,,27,https://security-tracker.debian.org/tracker/source-package/xorg-server,https://www.openhub.net/projects/xserver-xorg-driver-ati,xserver-xorg-driver-ati,,,,12,165,49507,C,,Decreasing Y-O-Y development activity,"Mature, well-established codebase",Average number of code comments,"Large, active development team",98546,,,0,0,0,8,"Website points: 1, CVE: 3, 12-month contributor: 0, Popularity: 2, Language: 2, Exposure: 0 , Data only: 0",
xserver-xorg-core,xorg-server,2:1.15.1-0ubuntu2.7,Xorg X server - core server,,27,https://security-tracker.debian.org/tracker/source-package/xorg-server,https://www.openhub.net/projects/xserver-xorg-driver-ati,xserver-xorg-driver-ati,,,,12,165,49507,C,,Decreasing Y-O-Y development activity,"Mature, well-established codebase",Average number of code comments,"Large, active development team",98944,,,0,0,0,8,"Website points: 1, CVE: 3, 12-month contributor: 0, Popularity: 2, Language: 2, Exposure: 0 , Data only: 0",X development is transitioning towards Wayland.
adduser,,3.113+nmu3ubuntu3,add and remove users and groups,http://alioth.debian.org/projects/adduser/,0,https://security-tracker.debian.org/tracker/source-package/adduser,https://www.openhub.net/projects/adduser,adduser,,,,0,4,2646,Perl,,Stable Y-O-Y development activity,"Mature, well-established codebase",Few source code comments,No recent development activity,175839,,,0,0,0,7,"Website points: 0, CVE: 0, 12-month contributor: 5, Popularity: 2, Language: 0, Exposure: 0 , Data only: 0",
apt-listchanges,,2.85.13ubuntu2,package change history notification tool,,0,https://security-tracker.debian.org/tracker/source-package/apt-listchanges,https://www.openhub.net/projects/8066,apt-listchanges,"apt-listchanges is a tool to show what has been changed in a new
 version of a Debian package, as compared to the version currently
 installed on the system.  It does this by extracting the relevant
 entries from the Debian changelog file, and the NEWS.Debian file.
 .
 It can be run on several .deb archives at a time to get a list of all
 of the changes that would be effected by installing or upgrading a
 group of packages.  It can be configured to do this automatically
 during upgrades using apt.",http://packages.debian.org/apt-listchanges,http://packages.debian.org/apt-listchanges,0,2,994,Python,GNU General Public License v2.0 or later,,"Mature, well-established codebase",,No recent development activity,141939,,,0,0,0,7,"Website points: 0, CVE: 0, 12-month contributor: 5, Popularity: 2, Language: 0, Exposure: 0 , Data only: 0",
bsdutils,util-linux (2.20.1-5.1ubuntu20.7),1:2.20.1-5.1ubuntu20.7,Basic utilities from 4.4BSD-Lite,http://userweb.kernel.org/~kzak/util-linux/,5,https://security-tracker.debian.org/tracker/source-package/util-linux,https://www.openhub.net/projects/util-linux-ng,util-linux,util-linux is a random collection of Linux utilities,http://en.wikipedia.org/wiki/Util-linux,http://ftp.kernel.org/pub/linux/utils/util-linux/,82,411,122275,C,BSD 4-clause (University of California-Specific) GNU General Public License v3.0 or later GNU Lesser General Public License v2.1 or later Public Domain / GPL When Compiled,Stable Y-O-Y development activity,"Mature, well-established codebase",Average number of code comments,"Very large, active development team",175849,,,0,0,0,7,"Website points: 0, CVE: 3, 12-month contributor: 0, Popularity: 2, Language: 2, Exposure: 0 , Data only: 0",
busybox,,1:1.21.0-1ubuntu1,Tiny utilities for small and embedded systems,http://www.busybox.net,5,https://security-tracker.debian.org/tracker/source-package/busybox,https://www.openhub.net/projects/busybox,BusyBox,"BusyBox combines tiny versions of many common UNIX utilities into a single small executable. It provides replacements for most of the utilities you usually find in GNU fileutils, shellutils, etc. The utilities in BusyBox generally have fewer options than their full-featured GNU cousins; however, the options that are included provide the expected functionality and behave very much like their GNU counterparts. BusyBox provides a fairly complete environment for any small or embedded system.

BusyBox has been written with size-optimization and limited resources in mind. It is also extremely modular so you can easily include or exclude commands (or features) at compile time. This makes it easy to customize your embedd",http://busybox.net/,http://busybox.net/download.html,44,253,175148,C,GNU General Public License v2.0 or later,Stable Y-O-Y development activity,"Mature, well-established codebase",Well-commented source code,"Very large, active development team",172930,,,0,0,0,7,"Website points: 0, CVE: 3, 12-month contributor: 0, Popularity: 2, Language: 2, Exposure: 0 , Data only: 0",
bzip2,,1.0.6-5,high-quality block-sorting file compressor - utilities,http://www.bzip.org/,2,https://security-tracker.debian.org/tracker/source-package/bzip2,https://www.openhub.net/projects/bzip2,,,,,,,,,,,,,,161114,,,0,1,0,7,"Website points: 0, CVE: 2, 12-month contributor: 2, Popularity: 2, Language: 0, Exposure: 1 , Data only: 0","Bzip2 is widely used for decompression of network-supplied data. No code repo, only released code source tarballs. This is the reference implementation, many alternate implementations shown on https://en.wikipedia.org/wiki/Bzip2. Last release in 2010, v1.0.6, in response to CVE-2010-0405. No forums found. At least one HTTP server supports bzip2 for compression.  +++"
debianutils,,4.4,Miscellaneous utilities specific to Debian,,0,https://security-tracker.debian.org/tracker/source-package/debianutils,https://www.openhub.net/projects/debian-installer-utils,debian-installer-utils,,,,3,89,1170,shell script,,Decreasing Y-O-Y development activity,"Mature, well-established codebase",Few source code comments,Small development team,175853,,,0,0,0,7,"Website points: 1, CVE: 0, 12-month contributor: 4, Popularity: 2, Language: 0, Exposure: 0 , Data only: 0","Collection of small tools.The tempfile(1) command is security-relevant (temp file mistakes are a common security vulnerability) but is relatively small, and usually the problem is a failure to use tempfile(1) or similar."
dnsmasq,,2.68-1ubuntu0.1,Small caching DNS proxy and DHCP/TFTP server,,3,https://security-tracker.debian.org/tracker/source-package/dnsmasq,https://www.openhub.net/projects/dnsmasq,Dnsmasq,"Dnsmasq is a lightweight, easy to configure DNS forwarder and DHCP server. It is designed to provide DNS and, optionally, DHCP, to a small network. It can serve the names of local machines which are not in the global DNS. The DHCP server integrates with the DNS server and allows machines with DHCP-allocated addresses to appear in the DNS with names configured either in each host or in a central configuration file. Dnsmasq supports static and dynamic DHCP leases and BOOTP/TFTP for network booting of diskless machines.",http://www.thekelleys.org.uk/dnsmasq/doc.html,http://www.thekelleys.org.uk/dnsmasq/doc.html,32,55,30311,C,GNU General Public License v2.0 or later GNU General Public License v3.0 or later,Decreasing Y-O-Y development activity,"Mature, well-established codebase",Few source code comments,"Very large, active development team",4871,,,1,1,0,7,"Website points: 0, CVE: 2, 12-month contributor: 0, Popularity: 1, Language: 2, Exposure: 2 , Data only: 0",
ffmpeg,,,,,197,https://security-tracker.debian.org/tracker/source-package/ffmpeg,https://www.openhub.net/projects/ffmpeg,FFmpeg,"FFmpeg is a complete solution to record, convert and stream audio and video. It includes libavcodec, the leading audio/video codec library. FFmpeg is mostly developed under Linux, but portable to operating systems, including Windows.",http://www.ffmpeg.org/,http://www.ffmpeg.org/download.html,297,1333,907891,C,GNU Lesser General Public License v2.1 or later,Stable Y-O-Y development activity,"Mature, well-established codebase",Few source code comments,"Very large, active development team",22984,,,0,1,0,7,"Website points: 0, CVE: 3, 12-month contributor: 0, Popularity: 1, Language: 2, Exposure: 1 , Data only: 0",
ftp,netkit-ftp,0.17-28,classical file transfer client,,0,https://security-tracker.debian.org/tracker/source-package/netkit-ftp,,,,,,,,,,,,,,,153650,,,1,0,0,7,"Website points: 1, CVE: 0, 12-month contributor: 2, Popularity: 2, Language: 0, Exposure: 2 , Data only: 0","Ftp isn't secure by itself, and the ftp client is less commonly used now.  That said, it certainly is used and connects to the wide Internet."
git,,1:1.9.1-1ubuntu0.1,"fast, scalable, distributed revision control system",http://git-scm.com/,3,https://security-tracker.debian.org/tracker/source-package/git,https://www.openhub.net/projects/git,Git,"Git is a fast, scalable, distributed revision control system with an unusually rich command set that provides both high-level operations and full access to internals.",http://git-scm.com/,http://git-scm.com/downloads,172,1345,366609,C,GNU General Public License v2.0 or later,Stable Y-O-Y development activity,"Mature, well-established codebase",Average number of code comments,"Very large, active development team",72047,,,0,1,0,7,"Website points: 0, CVE: 2, 12-month contributor: 0, Popularity: 2, Language: 2, Exposure: 1 , Data only: 0",
ifupdown,,0.7.47.2ubuntu4.1,high level tools to configure network interfaces,,0,https://security-tracker.debian.org/tracker/source-package/ifupdown,https://www.openhub.net/projects/ifupdown-ng,ifupdown-ng,Next-generation network interface configuration tool,https://github.com/kmoffett/ifupdown-ng,https://github.com/kmoffett/ifupdown-ng/downloads,0,1,830,Python,,Stable Y-O-Y development activity,Short source control history,Well-commented source code,No recent development activity,175544,,,0,0,0,7,"Website points: 0, CVE: 0, 12-month contributor: 5, Popularity: 2, Language: 0, Exposure: 0 , Data only: 0",
installation-report,,2.54ubuntu1,system installation report,,0,https://security-tracker.debian.org/tracker/source-package/installation-report,https://www.openhub.net/projects/installation-report,installation-report,,,,2,66,468,shell script,,Decreasing Y-O-Y development activity,"Mature, well-established codebase",Average number of code comments,Small development team,169061,,,0,0,0,7,"Website points: 1, CVE: 0, 12-month contributor: 4, Popularity: 2, Language: 0, Exposure: 0 , Data only: 0",
libapr1,apr,1.5.0-1,Apache Portable Runtime Library,http://apr.apache.org/,3,https://security-tracker.debian.org/tracker/source-package/apr,https://www.openhub.net/projects/apr,Apache Portable Runtime,"The mission of the Apache Portable Runtime (APR) project is to create and maintain software libraries that provide a predictable and consistent interface to underlying platform-specific implementations. The primary goal is to provide an API to which software developers may code and be assured of predictable if not identical behaviour regardless of the platform on which their software is built, relieving them of the need to code special-case conditions to work around or take advantage of platform-specific deficiencies or features.",http://apr.apache.org/,,14,67,419947,C,Apache License 2.0,Decreasing Y-O-Y development activity,"Mature, well-established codebase",Average number of code comments,"Large, active development team",125231,,,0,1,0,7,"Website points: 0, CVE: 2, 12-month contributor: 0, Popularity: 2, Language: 2, Exposure: 1 , Data only: 0","Important. The general Apache Portable Runtime (APR) appears to be actively maintained.  However, it's not as clear that the LDAP library in it is as actively managed. HAS Home Page, HAS Mailing List, Issue tracker https://bz.apache.org/bugzilla/enter_bug.cgi?product=APR \++"
libaprutil1-ldap,apr-util,1.5.3-1,Apache Portable Runtime Utility Library - LDAP Driver,http://apr.apache.org/,1,https://security-tracker.debian.org/tracker/source-package/apr-util,https://www.openhub.net/projects/apr,Apache Portable Runtime,"The mission of the Apache Portable Runtime (APR) project is to create and maintain software libraries that provide a predictable and consistent interface to underlying platform-specific implementations. The primary goal is to provide an API to which software developers may code and be assured of predictable if not identical behaviour regardless of the platform on which their software is built, relieving them of the need to code special-case conditions to work around or take advantage of platform-specific deficiencies or features.",http://apr.apache.org/,,14,67,419947,C,Apache License 2.0,Decreasing Y-O-Y development activity,"Mature, well-established codebase",Average number of code comments,"Large, active development team",109773,,,1,0,0,7,"Website points: 0, CVE: 1, 12-month contributor: 0, Popularity: 2, Language: 2, Exposure: 2 , Data only: 0","Important. The general Apache Portable Runtime (APR) appears to be actively maintained.  The LDAP driver is maintained as part of APR, http://apr.apache.org/ The APR-util version 1.5.4 was released September 22, 2014, so it is actively maintained. They use the apache.org repo and subversion; apr-util has been merged into main trunk, making it a little harder to see LDAP specifics to determine if the LDAP portion is active. Mailing list dev@apr.apache.org seems active. ++"
libblkid1,util-linux,2.20.1-5.1ubuntu20.7,block device id library,http://userweb.kernel.org/~kzak/util-linux/,5,https://security-tracker.debian.org/tracker/source-package/util-linux,https://www.openhub.net/projects/util-linux-ng,util-linux,util-linux is a random collection of Linux utilities,http://en.wikipedia.org/wiki/Util-linux,http://ftp.kernel.org/pub/linux/utils/util-linux/,82,411,122275,C,BSD 4-clause (University of California-Specific) GNU General Public License v3.0 or later GNU Lesser General Public License v2.1 or later Public Domain / GPL When Compiled,Stable Y-O-Y development activity,"Mature, well-established codebase",Average number of code comments,"Very large, active development team",175852,,,0,0,0,7,"Website points: 0, CVE: 3, 12-month contributor: 0, Popularity: 2, Language: 2, Exposure: 0 , Data only: 0",
libbz2-1.0,bzip2,1.0.6-5,high-quality block-sorting file compressor library - runtime,http://www.bzip.org/,2,https://security-tracker.debian.org/tracker/source-package/bzip2,https://www.openhub.net/projects/bzip2,,,,,,,,,,,,,,175844,,,0,1,0,7,"Website points: 0, CVE: 2, 12-month contributor: 2, Popularity: 2, Language: 0, Exposure: 1 , Data only: 0",Bzip2 is widely used for decompression of network-supplied data. ++
libgbm1,mesa,10.1.3-0ubuntu0.4,generic buffer management API -- runtime,http://mesa3d.sourceforge.net/,4,https://security-tracker.debian.org/tracker/source-package/mesa,https://www.openhub.net/projects/mesa,Mesa,"Mesa is an open-source implementation of the OpenGL specification - a system for rendering interactive 3D graphics.

A variety of device drivers allows Mesa to be used in many different environments ranging from software emulation to complete hardware acceleration for modern GPUs.

Mesa ties into several other open-source projects: the Direct Rendering Infrastructure and X.org to provide OpenGL support to users of X on Linux, FreeBSD and other operating systems.",http://sourceforge.net/projects/mesa3d,,168,697,1069564,C,MIT License,Stable Y-O-Y development activity,"Mature, well-established codebase",Average number of code comments,"Very large, active development team",60625,,,0,0,0,7,"Website points: 0, CVE: 3, 12-month contributor: 0, Popularity: 2, Language: 2, Exposure: 0 , Data only: 0",
libgl1-mesa-dri,mesa,10.1.3-0ubuntu0.4,free implementation of the OpenGL API -- DRI modules,http://mesa3d.sourceforge.net/,4,https://security-tracker.debian.org/tracker/source-package/mesa,https://www.openhub.net/projects/mesa,Mesa,"Mesa is an open-source implementation of the OpenGL specification - a system for rendering interactive 3D graphics.

A variety of device drivers allows Mesa to be used in many different environments ranging from software emulation to complete hardware acceleration for modern GPUs.

Mesa ties into several other open-source projects: the Direct Rendering Infrastructure and X.org to provide OpenGL support to users of X on Linux, FreeBSD and other operating systems.",http://sourceforge.net/projects/mesa3d,,168,697,1069564,C,MIT License,Stable Y-O-Y development activity,"Mature, well-established codebase",Average number of code comments,"Very large, active development team",115688,,,0,0,0,7,"Website points: 0, CVE: 3, 12-month contributor: 0, Popularity: 2, Language: 2, Exposure: 0 , Data only: 0",
libglapi-mesa,mesa,10.1.3-0ubuntu0.4,free implementation of the GL API -- shared library,http://mesa3d.sourceforge.net/,4,https://security-tracker.debian.org/tracker/source-package/mesa,https://www.openhub.net/projects/mesa,Mesa,"Mesa is an open-source implementation of the OpenGL specification - a system for rendering interactive 3D graphics.

A variety of device drivers allows Mesa to be used in many different environments ranging from software emulation to complete hardware acceleration for modern GPUs.

Mesa ties into several other open-source projects: the Direct Rendering Infrastructure and X.org to provide OpenGL support to users of X on Linux, FreeBSD and other operating systems.",http://sourceforge.net/projects/mesa3d,,168,697,1069564,C,MIT License,Stable Y-O-Y development activity,"Mature, well-established codebase",Average number of code comments,"Very large, active development team",105299,,,0,0,0,7,"Website points: 0, CVE: 3, 12-month contributor: 0, Popularity: 2, Language: 2, Exposure: 0 , Data only: 0",
libgpgme11,gpgme1.0,1.4.3-0.1ubuntu5.1,GPGME - GnuPG Made Easy (library),http://www.gnupg.org/gpgme.html,1,https://security-tracker.debian.org/tracker/source-package/gpgme1.0,https://www.openhub.net/projects/gpgme,GPGME,"GnuPG Made Easy (GPGME) is a library designed to make access to GnuPG easier for applications. It provides a High-Level Crypto API for encryption, decryption, signing, signature verification and key management. Currently it uses GnuPG as its backend but the API isn't restricted to this engine; in fact we have already developed a backend for CMS (S/MIME).",http://www.gnupg.org/gpgme.html,http://www.gnupg.org/download/index.html#gpgme,6,18,71248,C,"GNU Library or ""Lesser"" GPL (LGPL)",Decreasing Y-O-Y development activity,"Mature, well-established codebase",Average number of code comments,Average size development team,154299,,,1,0,0,7,"Website points: 0, CVE: 1, 12-month contributor: 0, Popularity: 2, Language: 2, Exposure: 2 , Data only: 0","Vital for protecting email (see gpg) Git repo available. Issue tracker site uses self-signed cert; it's concerning that a user would have to compromise the HTTPS security model just to view and interact with the bug tracker. Openhub doesn't reflect their mailing lists in *multiple languages*. Appears to be actively maintained mostly by one dev, but notably just got donations supporting him for the next 2-3 years. ++"
libgssglue1,libgssglue,0.4-2ubuntu1,mechanism-switch gssapi library,http://www.citi.umich.edu/projects/nfsv4/linux/,1,https://security-tracker.debian.org/tracker/source-package/libgssglue,,,,,,,,,,,,,,,101975,,,1,0,0,7,"Website points: 0, CVE: 1, 12-month contributor: 2, Popularity: 2, Language: 0, Exposure: 2 , Data only: 0",Vital for systems that use it
liblocale-gettext-perl,,1.05-7build3,module using libc functions for internationalization in Perl,http://search.cpan.org/dist/gettext/gettext.pm,0,https://security-tracker.debian.org/tracker/source-package/liblocale-gettext-perl,https://www.openhub.net/projects/catatylstgettex,Catalyst::Plugin::I18N::Gettext,The Perl module Catalyst::Plugin::I18N::Gettext is a internationalization plugin using GNU gettext in the Catalyst framework without using module Locale::Maketext.,http://sourceforge.net/projects/catatylstgettex/,,0,1,290,Perl,,Stable Y-O-Y development activity,Short source control history,Average number of code comments,No recent development activity,175708,,,0,0,0,7,"Website points: 0, CVE: 0, 12-month contributor: 5, Popularity: 2, Language: 0, Exposure: 0 , Data only: 0",
libmount1,util-linux,2.20.1-5.1ubuntu20.7,block device id library,http://userweb.kernel.org/~kzak/util-linux/,5,https://security-tracker.debian.org/tracker/source-package/util-linux,https://www.openhub.net/projects/util-linux-ng,util-linux,util-linux is a random collection of Linux utilities,http://en.wikipedia.org/wiki/Util-linux,http://ftp.kernel.org/pub/linux/utils/util-linux/,82,411,122275,C,BSD 4-clause (University of California-Specific) GNU General Public License v3.0 or later GNU Lesser General Public License v2.1 or later Public Domain / GPL When Compiled,Stable Y-O-Y development activity,"Mature, well-established codebase",Average number of code comments,"Very large, active development team",147667,,,0,0,0,7,"Website points: 0, CVE: 3, 12-month contributor: 0, Popularity: 2, Language: 2, Exposure: 0 , Data only: 0",
libpolarssl-runtime,polarssl,1.3.4-1,lightweight crypto and SSL/TLS library,http://polarssl.org,14,https://security-tracker.debian.org/tracker/source-package/polarssl,https://www.openhub.net/projects/polarssl,PolarSSL,"PolarSSL is a light-weight open-source cryptographic library for embedded systems.

Its designed to be:
 -    Low profile
 -   Self contained
 -   Easy to implement
 -   Very modular
 -   Easily expandable

It provides standard crypto blocks for: AES, Camellia, SHA-1, SHA-256, SHA512, X.509 certificates, etc. as well as higher lever protocols: SSL v3, TLS v1.0, TLS v1.1 and TLS v1.2.

PolarSSL has been ported on a number of architectures, including ARM, PowerPC, MIPS, and Motorola 68000. Its already small memory footprint can be easily reduced to 50k for a basic SSL client or server, by modifying a single .h configuration file. PolarSSL is currently used in several open-source (GPL) and closed-source projects, such as Adobe's flash player.",https://polarssl.org,https://polarssl.org/download,18,30,79948,C,Commercial License GNU General Public License v2.0 or later,Stable Y-O-Y development activity,"Mature, well-established codebase",Well-commented source code,"Large, active development team",40,,,1,0,0,7,"Website points: 0, CVE: 3, 12-month contributor: 0, Popularity: 0, Language: 2, Exposure: 2 , Data only: 0",SSL/TLS library.  Protocol is important.  This implementation is less widely used.
