project_name,debian_source,debian_version,debian_desc,debian_home,CVE_since_2010,CVE_page,openhub_page,openhub_name,openhub_desc,openhub_home,openhub_download,twelve_month_contributor_count,total_contributor_count,total_code_lines,main_language_name,licenses,fact_activity,fact_age,fact_comments,fact_team_size,package_popularity,implemented_in,role,direct_network_exposure,process_network_data,potential_privilege_escalation,risk_index(max = 15),risk_index components,comment_on_priority
libpam0g,pam,1.1.8-1ubuntu2,Pluggable Authentication Modules library,http://pam.sourceforge.net/,15,https://security-tracker.debian.org/tracker/source-package/pam,https://www.openhub.net/projects/linux-pam,Linux-PAM,Linux-PAM (Pluggable Authentication Modules for Linux) project.,http://www.linux-pam.org,https://fedorahosted.org/releases/l/i/linux-pam/,6,21,57024,C,"BSD 3-clause ""New"" or ""Revised"" License GNU General Public License v2.0 or later GNU General Public License v3.0 only",Decreasing Y-O-Y development activity,"Mature, well-established codebase",Average number of code comments,Average size development team,175848,,,1,0,0,9,"Website points: 0, CVE: 3, 12-month contributor: 0, Popularity: 2, Language: 2, Exposure: 2 , Data only: 0",Critical central role for authentication
libpciaccess0,libpciaccess,0.13.2-1,Generic PCI access library for X,,0,https://security-tracker.debian.org/tracker/source-package/libpciaccess,https://www.openhub.net/projects/pci-utility,PCI Configuration Utility.,pci-utility is utility developed to access PCI Device configuration Space. It enables user to read and write registers on PCI Configuration space of PCI Devices.,http://sourceforge.net/projects/pci-utility,,0,1,1119,C,,Stable Y-O-Y development activity,Short source control history,Average number of code comments,No recent development activity,113361,,,0,0,0,9,"Website points: 0, CVE: 0, 12-month contributor: 5, Popularity: 2, Language: 2, Exposure: 0 , Data only: 0",
libprocps0,,,,,0,https://security-tracker.debian.org/tracker/source-package/libprocps0,https://www.openhub.net/projects/procps,Procps - The /proc file system utilities,"procps is the package that has a bunch of small useful utilities that give information about processes using the /proc filesystem. The package includes the programs ps, top, vmstat, w, kill, free, slabtop, and skill.

Version 3 includes NPTL thread support, a rewritten top, many bug fixes, performance improvements, and new features.",http://procps.sourceforge.net/,http://procps.sourceforge.net/download.html,0,2,15622,C,GNU Lesser General Public License v2.1 or later,Stable Y-O-Y development activity,"Mature, well-established codebase",Average number of code comments,No recent development activity,92165,,,0,0,0,9,"Website points: 0, CVE: 0, 12-month contributor: 5, Popularity: 2, Language: 2, Exposure: 0 , Data only: 0",
libpthread-stubs0-dev,libpthread-stubs,0.3-4,"pthread stubs not provided by native libc, development files",,0,https://security-tracker.debian.org/tracker/source-package/libpthread-stubs,https://www.openhub.net/projects/libpthread-stubs,libpthread-stubs,"libpthread-stubs provides stub functions for pthreads as weak aliases for platforms on which libc does not provide these stubs.  Linking to both libc and libpthread-stubs will always provide a full set of pthread stubs, allowing programs and libraries to portably use pthreads when linked to pthreads and improve single-threaded performance when not linked to pthreads.",,http://xorg.freedesktop.org/releases/individual/lib/,0,8,120,C,MIT License,Stable Y-O-Y development activity,"Mature, well-established codebase",Very well-commented source code,No recent development activity,43588,,,0,0,0,9,"Website points: 1, CVE: 0, 12-month contributor: 5, Popularity: 1, Language: 2, Exposure: 0 , Data only: 0",
libssl1.0.0,openssl,1.0.1f-1ubuntu2.15,Secure Sockets Layer toolkit - shared libraries,,88,https://security-tracker.debian.org/tracker/source-package/openssl,https://www.openhub.net/projects/openssl,OpenSSL,"The OpenSSL Project is a collaborative effort to develop a robust, commercial-grade, full-featured, and Open Source toolkit implementing the Secure Sockets Layer (SSL v2/v3) and Transport Layer Security (TLS v1) protocols as well as a full-strength general purpose cryptography library. The project is managed by a worldwide community of volunteers that use the Internet to communicate, plan, and dev",http://www.openssl.org/,http://www.openssl.org//source/,92,201,443145,C,OpenSSL License,Increasing Y-O-Y development activity,"Mature, well-established codebase",Well-commented source code,"Very large, active development team",148065,,,1,0,0,9,"Website points: 0, CVE: 3, 12-month contributor: 0, Popularity: 2, Language: 2, Exposure: 2 , Data only: 0","Critical, in wide use.  OpenSSL is already funded by CII. ++"
libtasn1-3,,,,,6,https://security-tracker.debian.org/tracker/source-package/libtasn1-3,,,,,,,,,,,,,,,123177,,,0,1,0,9,"Website points: 1, CVE: 3, 12-month contributor: 2, Popularity: 2, Language: 0, Exposure: 1 , Data only: 0","Important because X.509 certificates (standard for certificates) use ASN.1. A Gnu project, git repo and mailing list available from home page. No issue tracker found. Search on 'security' in mailing list archives shows a few messages from Debian using security-related compiler flags. Debian security page shows a history of CVE's being fixed, most recent in 2014. OpenHub page at https://www.openhub.net/p/libtasn1 gives stats. Active effort of one developer, with others contributing as recently as 9 months ago. ++"
libudev0,,,,,0,https://security-tracker.debian.org/tracker/source-package/libudev0,https://www.openhub.net/projects/udev,udev,Managing device nodes in /dev on Linux.,http://www.freedesktop.org/software/systemd/man/udev.html,http://www.kernel.org/pub/linux/utils/kernel/hotplug/,0,224,23505,C,GNU General Public License v2.0 or later GNU Lesser General Public License v2.1 or later,Stable Y-O-Y development activity,"Mature, well-established codebase",Average number of code comments,No recent development activity,114725,,,0,0,0,9,"Website points: 0, CVE: 0, 12-month contributor: 5, Popularity: 2, Language: 2, Exposure: 0 , Data only: 0",
libusb-1.0-0,libusbx,2:1.0.17-1ubuntu2,userspace USB programming library,http://www.linux-usb.org/,0,https://security-tracker.debian.org/tracker/source-package/libusbx,https://www.openhub.net/projects/libusbx,libusbx,libusbx is a cross-platform user mode library that provides generic access to USB devices,http://libusbx.org,http://sourceforge.net/projects/libusbx/files/,0,71,28479,C,GNU Lesser General Public License v2.1 or later,Decreasing Y-O-Y development activity,"Mature, well-established codebase",Well-commented source code,No recent development activity,139738,,,0,0,0,9,"Website points: 0, CVE: 0, 12-month contributor: 5, Popularity: 2, Language: 2, Exposure: 0 , Data only: 0",
libustr-1.0-1,ustr,1.0.4-3ubuntu2,Micro string library: shared library,http://www.and.org/ustr/,0,https://security-tracker.debian.org/tracker/source-package/ustr,https://www.openhub.net/projects/10874,Ustr,"Micro string library, very low overhead from plain strdup() (Ave. 44% for 0-20B strings). Very easy to use in existing C code. At it's simplest you can
just include a single header file into your .c and start using it.",http://www.and.org/ustr/,http://www.and.org/ustr/,0,2,27200,C,MIT License,Stable Y-O-Y development activity,Short source control history,Very few source code comments,No recent development activity,148804,,,0,0,0,9,"Website points: 0, CVE: 0, 12-month contributor: 5, Popularity: 2, Language: 2, Exposure: 0 , Data only: 0",
libxcb-xkb1,libxcb,1.10-2ubuntu1,"X C Binding, XKEYBOARD extension",http://xcb.freedesktop.org,1,https://security-tracker.debian.org/tracker/source-package/libxcb,https://www.openhub.net/projects/libxcb,libxcb,,https://github.com/StarchLinux/libxcb,https://github.com/StarchLinux/libxcb/downloads,0,1,87401,C,,Stable Y-O-Y development activity,Short source control history,Very well-commented source code,No recent development activity,39921,,,0,0,0,9,"Website points: 0, CVE: 1, 12-month contributor: 5, Popularity: 1, Language: 2, Exposure: 0 , Data only: 0",
libxcb1-dev,libxcb,1.10-2ubuntu1,"X C Binding, development files",http://xcb.freedesktop.org,1,https://security-tracker.debian.org/tracker/source-package/libxcb,https://www.openhub.net/projects/libxcb,libxcb,,https://github.com/StarchLinux/libxcb,https://github.com/StarchLinux/libxcb/downloads,0,1,87401,C,,Stable Y-O-Y development activity,Short source control history,Very well-commented source code,No recent development activity,43400,,,0,0,0,9,"Website points: 0, CVE: 1, 12-month contributor: 5, Popularity: 1, Language: 2, Exposure: 0 , Data only: 0",
libxrender1,libxrender,1:0.9.8-1build0.14.04.1,X Rendering Extension client library,,1,https://security-tracker.debian.org/tracker/source-package/libxrender,https://www.openhub.net/projects/libxrender,libXrender,,http://cgit.freedesktop.org/xorg/lib/libXrender,http://cgit.freedesktop.org/xorg/lib/libXrender,2,31,2995,C,MIT License,Decreasing Y-O-Y development activity,"Mature, well-established codebase",Average number of code comments,Small development team,147410,,,0,0,0,9,"Website points: 0, CVE: 1, 12-month contributor: 4, Popularity: 2, Language: 2, Exposure: 0 , Data only: 0",
locales,langpack-locales,2.13+git20120306-12.1,common files for locale support,,0,https://security-tracker.debian.org/tracker/source-package/langpack-locales,https://www.openhub.net/projects/eglibc,EGLIBC,"Embedded GLIBC (EGLIBC) is a variant of the GNU C Library (GLIBC)  that is designed to work well on embedded systems. EGLIBC strives to be source and binary compatible with GLIBC. EGLIBC's goals include reduced footprint, configurable components, better support for cross-compilation and cross-testing.",http://www.eglibc.org/,,0,12,1239262,C,,Decreasing Y-O-Y development activity,"Mature, well-established codebase",Average number of code comments,No recent development activity,174513,,,0,0,0,9,"Website points: 0, CVE: 0, 12-month contributor: 5, Popularity: 2, Language: 2, Exposure: 0 , Data only: 0",
lzma,,9.22-2ubuntu2,Compression and decompression in the LZMA format - command line utility,http://www.7-zip.org/sdk.html,0,https://security-tracker.debian.org/tracker/source-package/lzma,https://www.openhub.net/projects/lzmautils,LZMA Utils,gzip- and zlib-like interfaces for LZMA compression from 7-Zip,http://sourceforge.net/projects/lzmautils,,0,2,9659,C++,,,Short source control history,Few source code comments,No recent development activity,17980,,,0,1,0,9,"Website points: 0, CVE: 0, 12-month contributor: 5, Popularity: 1, Language: 2, Exposure: 1 , Data only: 0",
menu,,2.1.46ubuntu1,generates programs menu for all menu-aware applications,,0,https://security-tracker.debian.org/tracker/source-package/menu,https://www.openhub.net/projects/8294,Debian menu,Generate menus files for applications from a list of menu entries files and an application specific menu-method file. This is the way coherence between installed packages and programs menu is achieved on Debian systems.,http://alioth.debian.org/projects/menu/,http://alioth.debian.org/scm/?group_id=30046,0,7,5098,C++,GNU General Public License v2.0 or later,Stable Y-O-Y development activity,"Mature, well-established codebase",Average number of code comments,No recent development activity,74957,,,0,0,0,9,"Website points: 0, CVE: 0, 12-month contributor: 5, Popularity: 2, Language: 2, Exposure: 0 , Data only: 0",
nfs-common,nfs-utils,1:1.2.8-6ubuntu1.1,NFS support files common to client and server,http://nfs.sourceforge.net/,4,https://security-tracker.debian.org/tracker/source-package/nfs-utils,https://www.openhub.net/projects/nfs-utils,nfs-utils,"The Network File System (NFS) was developed to allow machines to mount a disk partition on a remote machine as if it were a local disk. It allows for fast, seamless sharing of files across a network.",http://nfs.sourceforge.net/,http://sourceforge.net/projects/nfs/files/nfs-utils/,32,142,38970,C,GNU General Public License v2.0 or later,Increasing Y-O-Y development activity,"Mature, well-established codebase",Average number of code comments,"Very large, active development team",148629,,,1,0,0,9,"Website points: 0, CVE: 3, 12-month contributor: 0, Popularity: 2, Language: 2, Exposure: 2 , Data only: 0","Important for NFS, amount of use unclear."
ntp,,1:4.2.6.p5+dfsg-3ubuntu2.14.04.3,Network Time Protocol daemon and utility programs,http://support.ntp.org/,15,https://security-tracker.debian.org/tracker/source-package/ntp,,,,,,,,,,,,,,,62318,,,1,0,0,9,"Website points: 0, CVE: 3, 12-month contributor: 2, Popularity: 2, Language: 0, Exposure: 2 , Data only: 0","Directly connects to network and open to attack. HAS Home Page, NO issue tracker, Has Mailing list, public repo. CII investing. ++"
openssh-client,openssh,1:6.6p1-2ubuntu2.3,"secure shell (SSH) client, for secure access to remote machines",http://www.openssh.org/,17,https://security-tracker.debian.org/tracker/source-package/openssh,https://www.openhub.net/projects/openssh,OpenSSH,"OpenSSH is a free SSH/SecSH protocol suite providing encryption for network services like remote login or remote file transfer.

The following is a list of OpenSSH features:
    * Open Source Project
    * Free Licensing
    * Strong Encryption (3DES, Blowfish, AES, Arcfour)
    * X11 Forwarding (encrypt X Window System traffic)
    * Port Forwarding (encrypted channels for legacy protocols)
    * Strong Authentication (Public Key, One-Time Password and Kerberos Authentication)
    * Agent Forwarding (Single-Sign-On)
    * Interoperability (Compliance with SSH 1.3, 1.5, and 2.0 protocol Standards)
    * SFTP client and server support in both SSH1 and SSH2 protocols.
    * Kerberos and AFS Ticket Passing
    * Data Compression",http://www.openssh.com/,http://www.openssh.com/portable.html,22,93,69154,C,"BSD 3-clause ""New"" or ""Revised"" License",Stable Y-O-Y development activity,"Mature, well-established codebase",Average number of code comments,"Large, active development team",175193,,,1,0,0,9,"Website points: 0, CVE: 3, 12-month contributor: 0, Popularity: 2, Language: 2, Exposure: 2 , Data only: 0",Vital for security. CII already investing in this. ++
openssh-server,openssh,1:6.6p1-2ubuntu2.3,"secure shell (SSH) server, for secure access from remote machines",http://www.openssh.org/,17,https://security-tracker.debian.org/tracker/source-package/openssh,https://www.openhub.net/projects/openssh,OpenSSH,"OpenSSH is a free SSH/SecSH protocol suite providing encryption for network services like remote login or remote file transfer.

The following is a list of OpenSSH features:
    * Open Source Project
    * Free Licensing
    * Strong Encryption (3DES, Blowfish, AES, Arcfour)
    * X11 Forwarding (encrypt X Window System traffic)
    * Port Forwarding (encrypted channels for legacy protocols)
    * Strong Authentication (Public Key, One-Time Password and Kerberos Authentication)
    * Agent Forwarding (Single-Sign-On)
    * Interoperability (Compliance with SSH 1.3, 1.5, and 2.0 protocol Standards)
    * SFTP client and server support in both SSH1 and SSH2 protocols.
    * Kerberos and AFS Ticket Passing
    * Data Compression",http://www.openssh.com/,http://www.openssh.com/portable.html,22,93,69154,C,"BSD 3-clause ""New"" or ""Revised"" License",Stable Y-O-Y development activity,"Mature, well-established codebase",Average number of code comments,"Large, active development team",140936,,,1,0,0,9,"Website points: 0, CVE: 3, 12-month contributor: 0, Popularity: 2, Language: 2, Exposure: 2 , Data only: 0",Vital for security. CII already investing in this. ++
openssl,,1.0.1f-1ubuntu2.15,Secure Sockets Layer toolkit - cryptographic utility,,88,https://security-tracker.debian.org/tracker/source-package/openssl,https://www.openhub.net/projects/openssl,OpenSSL,"The OpenSSL Project is a collaborative effort to develop a robust, commercial-grade, full-featured, and Open Source toolkit implementing the Secure Sockets Layer (SSL v2/v3) and Transport Layer Security (TLS v1) protocols as well as a full-strength general purpose cryptography library. The project is managed by a worldwide community of volunteers that use the Internet to communicate, plan, and dev",http://www.openssl.org/,http://www.openssl.org//source/,92,201,443145,C,OpenSSL License,Increasing Y-O-Y development activity,"Mature, well-established codebase",Well-commented source code,"Very large, active development team",173279,,,1,0,0,9,"Website points: 0, CVE: 3, 12-month contributor: 0, Popularity: 2, Language: 2, Exposure: 2 , Data only: 0","Critical, in wide use.  OpenSSL is already funded by CII. ++"
procps,,1:3.3.9-1ubuntu2.2,/proc file system utilities,http://gitorious.org/procps,0,https://security-tracker.debian.org/tracker/source-package/procps,https://www.openhub.net/projects/procps,Procps - The /proc file system utilities,"procps is the package that has a bunch of small useful utilities that give information about processes using the /proc filesystem. The package includes the programs ps, top, vmstat, w, kill, free, slabtop, and skill.

Version 3 includes NPTL thread support, a rewritten top, many bug fixes, performance improvements, and new features.",http://procps.sourceforge.net/,http://procps.sourceforge.net/download.html,0,2,15622,C,GNU Lesser General Public License v2.1 or later,Stable Y-O-Y development activity,"Mature, well-established codebase",Average number of code comments,No recent development activity,175830,,,0,0,0,9,"Website points: 0, CVE: 0, 12-month contributor: 5, Popularity: 2, Language: 2, Exposure: 0 , Data only: 0",
reportbug,,6.5.0+nmu1ubuntu0.1,reports bugs in the Debian distribution,http://alioth.debian.org/projects/reportbug/,1,https://security-tracker.debian.org/tracker/source-package/reportbug,https://www.openhub.net/projects/reportbug,reportbug,,http://alioth.debian.org/projects/reportbug,,1,23,8579,Python,MIT License,Increasing Y-O-Y development activity,"Mature, well-established codebase",Few source code comments,Only a single active developer,155143,,,1,0,0,9,"Website points: 0, CVE: 1, 12-month contributor: 4, Popularity: 2, Language: 0, Exposure: 2 , Data only: 0",
rsyslog,,7.4.4-1ubuntu2.6,reliable system and kernel logging daemon,http://www.rsyslog.com/,9,https://security-tracker.debian.org/tracker/source-package/rsyslog,https://www.openhub.net/projects/rsyslog,rsyslog,"Rsyslog is an enhanced multi-threaded syslogd supporting, among others, MySQL, syslog/tcp, RFC 3195, permitted sender lists, filtering on any message part, and fine grain output format control. It is quite compatible to stock sysklogd and can be used as a drop-in replacement. Its advanced features make it suitable for enterprise-class, encryption protected syslog relay chains while at the same time being very easy to setup for the novice user. 

Over time, rsyslog has become the default syslogd for the many distributions.",http://www.rsyslog.com/,http://www.rsyslog.com/Downloads-index-req-viewdownload-cid-1-orderby-dateD.phtml,52,163,196367,C,GNU General Public License v3.0 only,Decreasing Y-O-Y development activity,"Mature, well-established codebase",Average number of code comments,"Very large, active development team",168299,,,1,0,0,9,"Website points: 0, CVE: 3, 12-month contributor: 0, Popularity: 2, Language: 2, Exposure: 2 , Data only: 0","Processes data from untrusted users.  Important today; as systemd becomes more used, its use may lessen but still important for merging data sources. Project page http://www.rsyslog.com/ Official repo on GitHub, https://github.com/rsyslog This is an active multi-person project; in the one-month period February 12, 2015     March 12, 2015, excluding merges, 7 authors have pushed 27 commits to master and 40 commits to all branches. On master, 37 files have changed and there have been 677 additions and 216 deletions. ++"
sysv-rc,sysvinit,2.88dsf-41ubuntu6.2,System-V-like runlevel change mechanism,http://savannah.nongnu.org/projects/sysvinit,0,https://security-tracker.debian.org/tracker/source-package/sysvinit,https://www.openhub.net/projects/sysvinit,sysvinit,"The Sysvinit package contains programs for controlling the startup, running, and shutdown of the system.",http://savannah.nongnu.org/projects/sysvinit,,0,2,8054,C,GNU General Public License v2.0 or later,Decreasing Y-O-Y development activity,Well-established codebase,Average number of code comments,No recent development activity,175680,,,0,0,0,9,"Website points: 0, CVE: 0, 12-month contributor: 5, Popularity: 2, Language: 2, Exposure: 0 , Data only: 0",
sysvinit,,,,,0,https://security-tracker.debian.org/tracker/source-package/sysvinit,https://www.openhub.net/projects/sysvinit,sysvinit,"The Sysvinit package contains programs for controlling the startup, running, and shutdown of the system.",http://savannah.nongnu.org/projects/sysvinit,,0,2,8054,C,GNU General Public License v2.0 or later,Decreasing Y-O-Y development activity,Well-established codebase,Average number of code comments,No recent development activity,129859,,,0,0,0,9,"Website points: 0, CVE: 0, 12-month contributor: 5, Popularity: 2, Language: 2, Exposure: 0 , Data only: 0",
sysvinit-utils,sysvinit,2.88dsf-41ubuntu6.2,System-V-like utilities,http://savannah.nongnu.org/projects/sysvinit,0,https://security-tracker.debian.org/tracker/source-package/sysvinit,https://www.openhub.net/projects/sysvinit,sysvinit,"The Sysvinit package contains programs for controlling the startup, running, and shutdown of the system.",http://savannah.nongnu.org/projects/sysvinit,,0,2,8054,C,GNU General Public License v2.0 or later,Decreasing Y-O-Y development activity,Well-established codebase,Average number of code comments,No recent development activity,175762,,,0,0,0,9,"Website points: 0, CVE: 0, 12-month contributor: 5, Popularity: 2, Language: 2, Exposure: 0 , Data only: 0",
vim-common,vim,2:7.4.052-1ubuntu3,Vi IMproved - Common files,http://www.vim.org/,1,https://security-tracker.debian.org/tracker/source-package/vim,https://www.openhub.net/projects/vim,Vim,"Vim is an advanced text editor that seeks to provide the power of the de-facto Unix editor 'Vi', with a more complete feature set. It's useful whether you're already using vi or using a different editor.",http://www.vim.org/,http://www.vim.org/download.php,1,12,845443,C,Vim License,Stable Y-O-Y development activity,"Mature, well-established codebase",Average number of code comments,Only a single active developer,174768,,,0,0,0,9,"Website points: 0, CVE: 1, 12-month contributor: 4, Popularity: 2, Language: 2, Exposure: 0 , Data only: 0",
vim-tiny,vim,2:7.4.052-1ubuntu3,Vi IMproved - enhanced vi editor - compact version,http://www.vim.org/,1,https://security-tracker.debian.org/tracker/source-package/vim,https://www.openhub.net/projects/vim,Vim,"Vim is an advanced text editor that seeks to provide the power of the de-facto Unix editor 'Vi', with a more complete feature set. It's useful whether you're already using vi or using a different editor.",http://www.vim.org/,http://www.vim.org/download.php,1,12,845443,C,Vim License,Stable Y-O-Y development activity,"Mature, well-established codebase",Average number of code comments,Only a single active developer,170043,,,0,0,0,9,"Website points: 0, CVE: 1, 12-month contributor: 4, Popularity: 2, Language: 2, Exposure: 0 , Data only: 0",
apache2-mpm-worker,apache2,2.4.7-1ubuntu4.6,transitional worker MPM package for apache2,http://httpd.apache.org/,47,https://security-tracker.debian.org/tracker/source-package/apache2,https://www.openhub.net/projects/apache,Apache HTTP Server,"The Apache HTTP Server Project is a collaborative software development effort aimed at creating a robust, commercial-grade, feature-rich, and freely-available source code implementation of an HTTP (Web) server. The project is jointly managed by a group of volunteers located around the world, using the Internet and the Web to communicate, plan, and develop the server and its related documentation. This project is part of the Apache Software Foundation. In addition, hundreds of users have contributed ideas, code, and documentation to the project.",http://httpd.apache.org/,http://httpd.apache.org/download.cgi,31,118,1761149,C,Apache License 2.0,Stable Y-O-Y development activity,"Mature, well-established codebase",Well-commented source code,"Very large, active development team",12488,,,1,0,0,8,"Website points: 0, CVE: 3, 12-month contributor: 0, Popularity: 1, Language: 2, Exposure: 2 , Data only: 0","Vitally important.  Note, however, that there's already large development & review team in place."
apt,,1.0.1ubuntu2.10,commandline package manager,,15,https://security-tracker.debian.org/tracker/source-package/apt,https://www.openhub.net/projects/apt,apt - Advanced Package Tool,"Debian's next generation front-end for the dpkg package manager. It provides the apt-get utility and APT dselect method that provides a simpler, safer way to install and upgrade packages.

APT features complete installation ordering, multiple source capability
and several other unique features.",https://wiki.debian.org/Apt,http://packages.qa.debian.org/a/apt.html,25,120,71636,C++,GNU General Public License v2.0 or later,Decreasing Y-O-Y development activity,"Mature, well-established codebase",Average number of code comments,"Large, active development team",175847,,,0,1,0,8,"Website points: 0, CVE: 3, 12-month contributor: 0, Popularity: 2, Language: 2, Exposure: 1 , Data only: 0","Should primarily be managing data from trusted source; if it ensures data source okay, less risky."
