project_name,debian_source,debian_version,debian_desc,debian_home,CVE_since_2010,CVE_page,openhub_page,openhub_name,openhub_desc,openhub_home,openhub_download,twelve_month_contributor_count,total_contributor_count,total_code_lines,main_language_name,licenses,fact_activity,fact_age,fact_comments,fact_team_size,package_popularity,implemented_in,role,direct_network_exposure,process_network_data,potential_privilege_escalation,risk_index(max = 15),risk_index components,comment_on_priority
libsemanage-common,libsemanage,2.2-1,Common files for SELinux policy management libraries,http://userspace.selinuxproject.org/,0,https://security-tracker.debian.org/tracker/source-package/libsemanage,https://www.openhub.net/projects/libsemanage,,,,,,,,,,,,,,148076,,,0,0,1,5,"Website points: 0, CVE: 0, 12-month contributor: 2, Popularity: 2, Language: 0, Exposure: 1 , Data only: 0",
libsm6,libsm,2:1.2.1-2,X11 Session Management library,,0,https://security-tracker.debian.org/tracker/source-package/libsm,,,,,,,,,,,,,,,139439,,,0,0,0,5,"Website points: 1, CVE: 0, 12-month contributor: 2, Popularity: 2, Language: 0, Exposure: 0 , Data only: 0",Just stores X11 sessions for later use.
libstdc++6,gcc-4.8,4.8.4-2ubuntu1~14.04,GNU Standard C++ Library v3,http://gcc.gnu.org/,1,https://security-tracker.debian.org/tracker/source-package/gcc-4.8,https://www.openhub.net/projects/gcc,GNU Compiler Collection,"The GNU Compiler Collection includes front ends for C, C++, Objective-C, Fortran, Java, and Ada, as well as libraries for these languages (libstdc++, libgcj,...).",http://gcc.gnu.org/,http://gcc.gnu.org/install/binaries.html,195,554,7227493,C,GNU General Public License v3.0 or later,Stable Y-O-Y development activity,"Mature, well-established codebase",Average number of code comments,"Very large, active development team",175803,,,0,0,0,5,"Website points: 0, CVE: 1, 12-month contributor: 0, Popularity: 2, Language: 2, Exposure: 0 , Data only: 0",
libxau6,libxau,1:1.0.8-1,X11 authorisation library,,0,https://security-tracker.debian.org/tracker/source-package/libxau,,,,,,,,,,,,,,,173735,,,0,0,0,5,"Website points: 1, CVE: 0, 12-month contributor: 2, Popularity: 2, Language: 0, Exposure: 0 , Data only: 0",
libxext6,libxext,2:1.3.2-1ubuntu0.0.14.04.1,X11 miscellaneous extension library,,1,https://security-tracker.debian.org/tracker/source-package/libxext,https://www.openhub.net/projects/x,X.Org,"X.Org provides an open source implementation of the network-transparent X Window System, as well as working on the standard itself.

The development work is being done as part of the freedesktop.org community, sponsored by the X.Org Foundation.",http://www.x.org,http://www.x.org/wiki/Releases/Download,159,1204,3325006,C,"BSD 3-clause ""New"" or ""Revised"" License MIT License",Decreasing Y-O-Y development activity,"Mature, well-established codebase",Average number of code comments,"Very large, active development team",172569,,,0,0,0,5,"Website points: 0, CVE: 1, 12-month contributor: 0, Popularity: 2, Language: 2, Exposure: 0 , Data only: 0",
libxfixes3,libxfixes,1:5.0.1-1ubuntu1.1,X11 miscellaneous 'fixes' extension library,,1,https://security-tracker.debian.org/tracker/source-package/libxfixes,https://www.openhub.net/projects/x,X.Org,"X.Org provides an open source implementation of the network-transparent X Window System, as well as working on the standard itself.

The development work is being done as part of the freedesktop.org community, sponsored by the X.Org Foundation.",http://www.x.org,http://www.x.org/wiki/Releases/Download,159,1204,3325006,C,"BSD 3-clause ""New"" or ""Revised"" License MIT License",Decreasing Y-O-Y development activity,"Mature, well-established codebase",Average number of code comments,"Very large, active development team",136427,,,0,0,0,5,"Website points: 0, CVE: 1, 12-month contributor: 0, Popularity: 2, Language: 2, Exposure: 0 , Data only: 0",
libxrandr2,libxrandr,2:1.4.2-1,X11 RandR extension library,,1,https://security-tracker.debian.org/tracker/source-package/libxrandr,https://www.openhub.net/projects/x,X.Org,"X.Org provides an open source implementation of the network-transparent X Window System, as well as working on the standard itself.

The development work is being done as part of the freedesktop.org community, sponsored by the X.Org Foundation.",http://www.x.org,http://www.x.org/wiki/Releases/Download,159,1204,3325006,C,"BSD 3-clause ""New"" or ""Revised"" License MIT License",Decreasing Y-O-Y development activity,"Mature, well-established codebase",Average number of code comments,"Very large, active development team",134025,,,0,0,0,5,"Website points: 0, CVE: 1, 12-month contributor: 0, Popularity: 2, Language: 2, Exposure: 0 , Data only: 0",
libzrtpcpp2,libzrtpcpp,2.0.0-3build2,ccrtp extension for zrtp/Zfone support,http://www.gnu.org/software/ccrtp/,3,https://security-tracker.debian.org/tracker/source-package/libzrtpcpp,,,,,,,,,,,,,,,820,,,0,1,0,5,"Website points: 0, CVE: 2, 12-month contributor: 2, Popularity: 0, Language: 0, Exposure: 1 , Data only: 0",
linux-base,,3.5ubuntu4,Linux image base package,,0,https://security-tracker.debian.org/tracker/source-package/linux-base,,,,,,,,,,,,,,,166753,,,0,0,0,5,"Website points: 1, CVE: 0, 12-month contributor: 2, Popularity: 2, Language: 0, Exposure: 0 , Data only: 0",These are small scripts and utilities for the Linux kernel.
parted,,2.3-19ubuntu1.14.04.1,disk partition manipulator,http://www.gnu.org/software/parted,0,https://security-tracker.debian.org/tracker/source-package/parted,https://www.openhub.net/projects/gparted,GNU Parted,"GNU Parted is an industrial-strength package for creating, destroying, resizing, checking and copying partitions, and the file systems on them. This is useful for creating space for new operating systems, reorganising disk usage, copying data on hard disks and disk imaging.",http://www.gnu.org/software/parted,http://www.gnu.org/software/parted,8,76,264460,C,GNU General Public License v3.0 only,Decreasing Y-O-Y development activity,"Mature, well-established codebase",Average number of code comments,"Large, active development team",72767,,,0,0,1,5,"Website points: 0, CVE: 0, 12-month contributor: 0, Popularity: 2, Language: 2, Exposure: 1 , Data only: 0",
perl,,5.18.2-2ubuntu1,Larry Wall's Practical Extraction and Report Language,http://dev.perl.org/perl5/,21,https://security-tracker.debian.org/tracker/source-package/perl,https://www.openhub.net/projects/perl,Perl,"Perl is a general-purpose programming language originally developed for text manipulation and now used for a wide range of tasks including system administration, web development, network programming, GUI development, and more. Its major features include support for multiple programming paradigms (procedural, object-oriented, and functional styles), automatic memory management, built-in support for text processing, and a large collection of third-party modules.",http://www.perl.org/,http://www.perl.org/get.html,85,1211,1048254,Perl,Artistic License GNU General Public License 1.0 GNU General Public License v2.0 or later,Stable Y-O-Y development activity,"Mature, well-established codebase",Well-commented source code,"Very large, active development team",175210,,,0,0,0,5,"Website points: 0, CVE: 3, 12-month contributor: 0, Popularity: 2, Language: 0, Exposure: 0 , Data only: 0",
perl-base,perl,5.18.2-2ubuntu1,minimal Perl system,http://dev.perl.org/perl5/,21,https://security-tracker.debian.org/tracker/source-package/perl,https://www.openhub.net/projects/perl,Perl,"Perl is a general-purpose programming language originally developed for text manipulation and now used for a wide range of tasks including system administration, web development, network programming, GUI development, and more. Its major features include support for multiple programming paradigms (procedural, object-oriented, and functional styles), automatic memory management, built-in support for text processing, and a large collection of third-party modules.",http://www.perl.org/,http://www.perl.org/get.html,85,1211,1048254,Perl,Artistic License GNU General Public License 1.0 GNU General Public License v2.0 or later,Stable Y-O-Y development activity,"Mature, well-established codebase",Well-commented source code,"Very large, active development team",175851,,,0,0,0,5,"Website points: 0, CVE: 3, 12-month contributor: 0, Popularity: 2, Language: 0, Exposure: 0 , Data only: 0",
perl-modules,perl,5.18.2-2ubuntu1,Core Perl modules,http://dev.perl.org/perl5/,21,https://security-tracker.debian.org/tracker/source-package/perl,https://www.openhub.net/projects/perl,Perl,"Perl is a general-purpose programming language originally developed for text manipulation and now used for a wide range of tasks including system administration, web development, network programming, GUI development, and more. Its major features include support for multiple programming paradigms (procedural, object-oriented, and functional styles), automatic memory management, built-in support for text processing, and a large collection of third-party modules.",http://www.perl.org/,http://www.perl.org/get.html,85,1211,1048254,Perl,Artistic License GNU General Public License 1.0 GNU General Public License v2.0 or later,Stable Y-O-Y development activity,"Mature, well-established codebase",Well-commented source code,"Very large, active development team",175225,,,0,0,0,5,"Website points: 0, CVE: 3, 12-month contributor: 0, Popularity: 2, Language: 0, Exposure: 0 , Data only: 0",
python-reportbug,reportbug,6.5.0+nmu1ubuntu0.1,Python modules for interacting with bug tracking systems,http://alioth.debian.org/projects/reportbug/,1,https://security-tracker.debian.org/tracker/source-package/reportbug,,,,,,,,,,,,,,,149862,,,0,0,0,5,"Website points: 0, CVE: 1, 12-month contributor: 2, Popularity: 2, Language: 0, Exposure: 0 , Data only: 0",
python2.6,,,,,26,https://security-tracker.debian.org/tracker/source-package/python2.6,https://www.openhub.net/projects/python,Python programming language,"Python is a dynamic, object-oriented programming language that can be used for many kinds of software development. It offers strong support for integration with other languages and tools, comes with extensive standard libraries, and can be learned in a few days. Many Python programmers report substantial productivity gains and feel the language encourages the development of better code.",https://www.python.org,https://www.python.org/downloads/,52,208,998797,Python,Python Software Foundation License 2.1.1,Stable Y-O-Y development activity,"Mature, well-established codebase",Average number of code comments,"Very large, active development team",100209,,,0,0,0,5,"Website points: 0, CVE: 3, 12-month contributor: 0, Popularity: 2, Language: 0, Exposure: 0 , Data only: 0",
python2.7,,2.7.6-8ubuntu0.2,Interactive high-level object-oriented language (version 2.7),,24,https://security-tracker.debian.org/tracker/source-package/python2.7,https://www.openhub.net/projects/python,Python programming language,"Python is a dynamic, object-oriented programming language that can be used for many kinds of software development. It offers strong support for integration with other languages and tools, comes with extensive standard libraries, and can be learned in a few days. Many Python programmers report substantial productivity gains and feel the language encourages the development of better code.",https://www.python.org,https://www.python.org/downloads/,52,208,998797,Python,Python Software Foundation License 2.1.1,Stable Y-O-Y development activity,"Mature, well-established codebase",Average number of code comments,"Very large, active development team",146101,,,0,0,0,5,"Website points: 0, CVE: 3, 12-month contributor: 0, Popularity: 2, Language: 0, Exposure: 0 , Data only: 0",
python2.7-minimal,python2.7,2.7.6-8ubuntu0.2,Minimal subset of the Python language (version 2.7),,24,https://security-tracker.debian.org/tracker/source-package/python2.7,https://www.openhub.net/projects/python,Python programming language,"Python is a dynamic, object-oriented programming language that can be used for many kinds of software development. It offers strong support for integration with other languages and tools, comes with extensive standard libraries, and can be learned in a few days. Many Python programmers report substantial productivity gains and feel the language encourages the development of better code.",https://www.python.org,https://www.python.org/downloads/,52,208,998797,Python,Python Software Foundation License 2.1.1,Stable Y-O-Y development activity,"Mature, well-established codebase",Average number of code comments,"Very large, active development team",146155,,,0,0,0,5,"Website points: 0, CVE: 3, 12-month contributor: 0, Popularity: 2, Language: 0, Exposure: 0 , Data only: 0",
sendmail,,8.14.4-4.1ubuntu1,"powerful, efficient, and scalable Mail Transport Agent",http://www.sendmail.org,1,https://security-tracker.debian.org/tracker/source-package/sendmail,https://www.openhub.net/projects/4536,,,,,,,,,,,,,,1790,,,1,0,0,5,"Website points: 0, CVE: 1, 12-month contributor: 2, Popularity: 0, Language: 0, Exposure: 2 , Data only: 0","This is a widely-used mail transfer agent (MTA). Sendmail main site https://www.sendmail.com/sm/open_source/
No public repo found.  However, they have tarball    snapshots   ; on 2015-03-13 the current snapshot was 2015-03-06. This indicates active development, but its development seems opaque so difficult to say more. Version 8.15.1 posted 2014-12-06."
sensible-utils,,0.0.9,Utilities for sensible alternative selection,,0,https://security-tracker.debian.org/tracker/source-package/sensible-utils,https://www.openhub.net/projects/debianutils,,,,,,,,,,,,,,168759,,,0,0,0,5,"Website points: 1, CVE: 0, 12-month contributor: 2, Popularity: 2, Language: 0, Exposure: 0 , Data only: 0",
sgml-base,,1.26+nmu4ubuntu1,SGML infrastructure and SGML catalog file support,,0,https://security-tracker.debian.org/tracker/source-package/sgml-base,,,,,,,,,,,,,,,163330,,,0,0,0,5,"Website points: 1, CVE: 0, 12-month contributor: 2, Popularity: 2, Language: 0, Exposure: 0 , Data only: 0",
ssl-cert,,1.0.33,simple debconf wrapper for OpenSSL,,0,https://security-tracker.debian.org/tracker/source-package/ssl-cert,https://www.openhub.net/projects/debconf,debconf,,,,5,23,9385,Perl,,Increasing Y-O-Y development activity,"Mature, well-established codebase",Well-commented source code,Average size development team,137047,,,1,0,0,5,"Website points: 1, CVE: 0, 12-month contributor: 0, Popularity: 2, Language: 0, Exposure: 2 , Data only: 0",See OpenSSL.
xfonts-base,,1:1.0.3,standard fonts for X,,0,https://security-tracker.debian.org/tracker/source-package/xfonts-base,https://www.openhub.net/projects/xfonts,,,,,,,,,,,,,,101023,,,0,0,0,5,"Website points: 1, CVE: 0, 12-month contributor: 2, Popularity: 2, Language: 0, Exposure: 0 , Data only: 0",
xfonts-encodings,,1:1.0.4-1ubuntu1,Encodings for X.Org fonts,,0,https://security-tracker.debian.org/tracker/source-package/xfonts-encodings,https://www.openhub.net/projects/xfonts,,,,,,,,,,,,,,114888,,,0,0,0,5,"Website points: 1, CVE: 0, 12-month contributor: 2, Popularity: 2, Language: 0, Exposure: 0 , Data only: 0",
xfonts-utils,,1:7.7+1,X Window System font utility programs,,0,https://security-tracker.debian.org/tracker/source-package/xfonts-utils,https://www.openhub.net/projects/xfonts,,,,,,,,,,,,,,114795,,,0,0,0,5,"Website points: 1, CVE: 0, 12-month contributor: 2, Popularity: 2, Language: 0, Exposure: 0 , Data only: 0",
bc,,1.06.95-8ubuntu1,GNU bc arbitrary precision calculator language,http://ftp.gnu.org/gnu/bc/,0,https://security-tracker.debian.org/tracker/source-package/bc,,,,,,,,,,,,,,,159178,,,0,0,0,4,"Website points: 0, CVE: 0, 12-month contributor: 2, Popularity: 2, Language: 0, Exposure: 0 , Data only: 0",Use relatively rare.  Unlikely to process data from attacker.
bootp,,2.4.3-18,server for the bootp protocol with DHCP support,ftp://ftp.ntplx.net/pub/networking/bootp/,0,https://security-tracker.debian.org/tracker/source-package/bootp,,,,,,,,,,,,,,,122,,,1,0,0,4,"Website points: 0, CVE: 0, 12-month contributor: 2, Popularity: 0, Language: 0, Exposure: 2 , Data only: 0",Bootp has basic seucurity issues.
cpp,gcc-defaults (1.124ubuntu6),4:4.8.2-1ubuntu6,GNU C preprocessor (cpp),,0,https://security-tracker.debian.org/tracker/source-package/gcc-defaults,https://www.openhub.net/projects/gcc,GNU Compiler Collection,"The GNU Compiler Collection includes front ends for C, C++, Objective-C, Fortran, Java, and Ada, as well as libraries for these languages (libstdc++, libgcj,...).",http://gcc.gnu.org/,http://gcc.gnu.org/install/binaries.html,195,554,7227493,C,GNU General Public License v3.0 or later,Stable Y-O-Y development activity,"Mature, well-established codebase",Average number of code comments,"Very large, active development team",146606,,,0,0,0,4,"Website points: 0, CVE: 0, 12-month contributor: 0, Popularity: 2, Language: 2, Exposure: 0 , Data only: 0",
cpp-4.6,gcc-4.6,4.6.4-6ubuntu2,GNU C preprocessor,http://gcc.gnu.org/,1,https://security-tracker.debian.org/tracker/source-package/gcc-4.6,https://www.openhub.net/projects/gcc,GNU Compiler Collection,"The GNU Compiler Collection includes front ends for C, C++, Objective-C, Fortran, Java, and Ada, as well as libraries for these languages (libstdc++, libgcj,...).",http://gcc.gnu.org/,http://gcc.gnu.org/install/binaries.html,195,554,7227493,C,GNU General Public License v3.0 or later,Stable Y-O-Y development activity,"Mature, well-established codebase",Average number of code comments,"Very large, active development team",36165,,,0,0,0,4,"Website points: 0, CVE: 1, 12-month contributor: 0, Popularity: 1, Language: 2, Exposure: 0 , Data only: 0",
cryptsetup,,2:1.6.1-1ubuntu1,disk encryption support - startup scripts,http://code.google.com/p/cryptsetup/,0,https://security-tracker.debian.org/tracker/source-package/cryptsetup,https://www.openhub.net/projects/cryptsetup,cryptsetup/LUKS,"Cryptsetup is utility used to conveniently setup disk encryption based on dm-crypt kernel module.

These include plain dm-crypt volumes, LUKS volumes, loop-AES and TrueCrypt (including VeraCrypt extension) format.

Project also includes veritysetup utility used to conveniently setup dm-verity block integrity checking kernel module.",https://gitlab.com/cryptsetup/cryptsetup/wikis/home,https://www.kernel.org/pub/linux/utils/cryptsetup/,7,16,19270,C,GNU General Public License v2.0 or later,Stable Y-O-Y development activity,"Mature, well-established codebase",Average number of code comments,"Large, active development team",11606,,,0,0,1,4,"Website points: 0, CVE: 0, 12-month contributor: 0, Popularity: 1, Language: 2, Exposure: 1 , Data only: 0","This is used to set up disk encryption (at rest), e.g., Linux Unified Key Setup (LUKS).  Home page http://code.google.com/p/cryptsetup , uses git. Tracker in active use.  Latest version 1.6.6 released 2014-08-16.  Development ongoing; 8 commits in February 2015. ++"
dash,,0.5.7-4ubuntu1,POSIX-compliant shell,http://gondor.apana.org.au/~herbert/dash/,0,https://security-tracker.debian.org/tracker/source-package/dash,https://www.openhub.net/projects/dash,DASH,DASH is a POSIX-compliant implementation of /bin/sh that aims to be as small as possible.,http://gondor.apana.org.au/~herbert/dash/,http://gondor.apana.org.au/~herbert/dash/files/,9,39,13392,C,BSD 4-clause (University of California-Specific),Increasing Y-O-Y development activity,"Mature, well-established codebase",Average number of code comments,"Large, active development team",169336,,,0,0,0,4,"Website points: 0, CVE: 0, 12-month contributor: 0, Popularity: 2, Language: 2, Exposure: 0 , Data only: 0",
dc,bc,1.06.95-8ubuntu1,GNU dc arbitrary precision reverse-polish calculator,http://ftp.gnu.org/gnu/bc/,0,https://security-tracker.debian.org/tracker/source-package/bc,,,,,,,,,,,,,,,154174,,,0,0,0,4,"Website points: 0, CVE: 0, 12-month contributor: 2, Popularity: 2, Language: 0, Exposure: 0 , Data only: 0",Use relatively rare.  Unlikely to process data from attacker.
debian-faq,,5.0.2ubuntu1,Debian FAQ,http://www.debian.org/doc/user-manuals#faq,0,https://security-tracker.debian.org/tracker/source-package/debian-faq,,,,,,,,,,,,,,,146829,,,0,0,0,4,"Website points: 0, CVE: 0, 12-month contributor: 2, Popularity: 2, Language: 0, Exposure: 0 , Data only: 0",
dictionaries-common,,1.20.5,Common utilities for spelling dictionary tools,http://dict-common.alioth.debian.org,0,https://security-tracker.debian.org/tracker/source-package/dictionaries-common,https://www.openhub.net/projects/dict-common,,,,,,,,,,,,,,156753,,,0,0,0,4,"Website points: 0, CVE: 0, 12-month contributor: 2, Popularity: 2, Language: 0, Exposure: 0 , Data only: 0",
findutils,,4.4.2-7,"utilities for finding files--find, xargs",http://savannah.gnu.org/projects/findutils/,0,https://security-tracker.debian.org/tracker/source-package/findutils,https://www.openhub.net/projects/findutils,GNU findutils,"GNU findutils includes find, xargs, locate and updatedb.  These tools proivide ways to search for files on your system by specifying what kind of file you're looking for.",http://savannah.gnu.org/projects/findutils/,,7,30,18425,C,GNU General Public License v3.0 or later,Stable Y-O-Y development activity,"Mature, well-established codebase",Average number of code comments,"Large, active development team",175849,,,0,0,0,4,"Website points: 0, CVE: 0, 12-month contributor: 0, Popularity: 2, Language: 2, Exposure: 0 , Data only: 0",
gcc,gcc-defaults (1.124ubuntu6),4:4.8.2-1ubuntu6,GNU C compiler,,0,https://security-tracker.debian.org/tracker/source-package/gcc-defaults,https://www.openhub.net/projects/gcc,GNU Compiler Collection,"The GNU Compiler Collection includes front ends for C, C++, Objective-C, Fortran, Java, and Ada, as well as libraries for these languages (libstdc++, libgcj,...).",http://gcc.gnu.org/,http://gcc.gnu.org/install/binaries.html,195,554,7227493,C,GNU General Public License v3.0 or later,Stable Y-O-Y development activity,"Mature, well-established codebase",Average number of code comments,"Very large, active development team",113304,,,0,0,0,4,"Website points: 0, CVE: 0, 12-month contributor: 0, Popularity: 2, Language: 2, Exposure: 0 , Data only: 0",
gcc-4.6,,4.6.4-6ubuntu2,GNU C compiler,http://gcc.gnu.org/,1,https://security-tracker.debian.org/tracker/source-package/gcc-4.6,https://www.openhub.net/projects/gcc,GNU Compiler Collection,"The GNU Compiler Collection includes front ends for C, C++, Objective-C, Fortran, Java, and Ada, as well as libraries for these languages (libstdc++, libgcj,...).",http://gcc.gnu.org/,http://gcc.gnu.org/install/binaries.html,195,554,7227493,C,GNU General Public License v3.0 or later,Stable Y-O-Y development activity,"Mature, well-established codebase",Average number of code comments,"Very large, active development team",35732,,,0,0,0,4,"Website points: 0, CVE: 1, 12-month contributor: 0, Popularity: 1, Language: 2, Exposure: 0 , Data only: 0",
gcc-4.6-base,gcc-4.6,4.6.4-6ubuntu2,"GCC, the GNU Compiler Collection (base package)",http://gcc.gnu.org/,1,https://security-tracker.debian.org/tracker/source-package/gcc-4.6,https://www.openhub.net/projects/gcc,GNU Compiler Collection,"The GNU Compiler Collection includes front ends for C, C++, Objective-C, Fortran, Java, and Ada, as well as libraries for these languages (libstdc++, libgcj,...).",http://gcc.gnu.org/,http://gcc.gnu.org/install/binaries.html,195,554,7227493,C,GNU General Public License v3.0 or later,Stable Y-O-Y development activity,"Mature, well-established codebase",Average number of code comments,"Very large, active development team",37200,,,0,0,0,4,"Website points: 0, CVE: 1, 12-month contributor: 0, Popularity: 1, Language: 2, Exposure: 0 , Data only: 0",
gcc-4.7,,4.7.3-12ubuntu1,GNU C compiler,http://gcc.gnu.org/,1,https://security-tracker.debian.org/tracker/source-package/gcc-4.7,https://www.openhub.net/projects/gcc,GNU Compiler Collection,"The GNU Compiler Collection includes front ends for C, C++, Objective-C, Fortran, Java, and Ada, as well as libraries for these languages (libstdc++, libgcj,...).",http://gcc.gnu.org/,http://gcc.gnu.org/install/binaries.html,195,554,7227493,C,GNU General Public License v3.0 or later,Stable Y-O-Y development activity,"Mature, well-established codebase",Average number of code comments,"Very large, active development team",52893,,,0,0,0,4,"Website points: 0, CVE: 1, 12-month contributor: 0, Popularity: 1, Language: 2, Exposure: 0 , Data only: 0",
gettext-base,gettext,0.18.3.1-1ubuntu3,GNU Internationalization utilities for the base system,http://www.gnu.org/software/gettext/,0,https://security-tracker.debian.org/tracker/source-package/gettext,https://www.openhub.net/projects/gettext,gettext,gettext is the GNU internationalization (i18n) library. It is commonly used for writing multilingual programs.,http://savannah.gnu.org/projects/gettext/,http://ftp.gnu.org/gnu/gettext,16,45,359627,C,"GNU General Public License v2.0 or later GNU General Public License v3.0 or later GNU Library or ""Lesser"" GPL (LGPL)",Increasing Y-O-Y development activity,"Mature, well-established codebase",Well-commented source code,"Large, active development team",174323,,,0,0,0,4,"Website points: 0, CVE: 0, 12-month contributor: 0, Popularity: 2, Language: 2, Exposure: 0 , Data only: 0",
